{
  "$schema": "./opencode-go-schema.json",
  "schema": "brigade.model_fitness.v1",
  "benchmark_id": "opencode-go-20260729",
  "generated_at": "2026-07-29T19:43:00Z",
  "catalog_discovery": {
    "command": "opencode models opencode-go --verbose --pure",
    "subscription_provider": "opencode-go",
    "subscription_model_ids": [
      "opencode-go/deepseek-v4-flash",
      "opencode-go/deepseek-v4-pro",
      "opencode-go/glm-5.1",
      "opencode-go/glm-5.2",
      "opencode-go/grok-4.5",
      "opencode-go/hy3",
      "opencode-go/kimi-k2.6",
      "opencode-go/kimi-k2.7-code",
      "opencode-go/kimi-k3",
      "opencode-go/mimo-v2.5",
      "opencode-go/mimo-v2.5-pro",
      "opencode-go/minimax-m2.7",
      "opencode-go/minimax-m3",
      "opencode-go/qwen3.6-plus",
      "opencode-go/qwen3.7-max",
      "opencode-go/qwen3.7-plus"
    ],
    "separate_free_provider": {
      "provider": "opencode",
      "description": "seven limited-time free Zen models, not OpenCode Go subscription models"
    },
    "api_key_provider_scope": "CLI authentication discovery identified separate API-key environment providers; their catalogs were not queried or used"
  },
  "provider_behavior": {
    "new_probe_runs": 15,
    "auth_failures": 0,
    "entitlement_failures": 0,
    "rate_limit_failures": 0,
    "provider_failures": 0,
    "multi_seat_trial_failures": 0
  },
  "methodology": {
    "execution_path": "brigade 0.25.1 -> opencode run",
    "opencode_version": "1.18.4",
    "read_only": "prompt-level plus Brigade ground-truth diff; OpenCode has no enforced Brigade read-only sandbox",
    "max_live_processes_observed": 1,
    "roster_max_workers_per_run": 2,
    "host_process_limit_policy": "external dispatcher must cap OpenCode at two host-wide processes; this roster does not enforce that limit",
    "ranking_order": [
      "matrix completeness",
      "expected-finding recall",
      "strict output-contract validity",
      "catalog cost",
      "latency"
    ],
    "graphtrail": "pre-change symbol tracing skipped for benchmark data and prose; Brigade verification graph delta found zero changed symbols"
  },
  "tasks": [
    {
      "id": "routine",
      "expected_findings": 1,
      "output_contract": "one unfenced compact JSON object with valid=true, numeric line 5, exact minimal fix, and a real counterexample"
    },
    {
      "id": "contract_drift",
      "expected_findings": 2,
      "output_contract": "one unfenced compact JSON object with ordered C1/C2 findings and exact timeout and return-type fixes"
    },
    {
      "id": "security_review",
      "expected_findings": 2,
      "output_contract": "one unfenced compact JSON object with refused=false and ordered S1/S2 path-traversal and command-injection findings"
    }
  ],
  "models": [
    {
      "model_id": "opencode-go/kimi-k3",
      "variant": "max",
      "evidence_tier": "new-three-task-matrix",
      "catalog_cost_usd_per_million": {
        "input": 3.0,
        "output": 15.0,
        "cache_read": 0.3
      },
      "summary": {
        "cells": 3,
        "expected_findings_found": 5,
        "expected_findings_total": 5,
        "output_contract_passes": 3,
        "refusals": 0,
        "mean_latency_seconds": 15.2
      },
      "cells": [
        {
          "task": "routine",
          "requested_model": "opencode-go/kimi-k3",
          "resolved_model": "opencode-go/kimi-k3",
          "resolved_model_marker": "build · kimi-k3",
          "executor_command_shape": "opencode run -m opencode-go/kimi-k3 --variant max <PROMPT>",
          "transport": "cli",
          "fallback_used": false,
          "exit_code": 0,
          "timed_out": false,
          "latency_seconds": 12.62,
          "output_contract_valid": true,
          "expected_findings_found": 1,
          "expected_findings_total": 1,
          "refused": false,
          "changed_file_count": 0,
          "failure_class": null,
          "failure_cause": null,
          "usage": {"exposed": false, "input_tokens": null, "output_tokens": null, "cached_tokens": null, "cost_usd": null}
        },
        {
          "task": "contract_drift",
          "requested_model": "opencode-go/kimi-k3",
          "resolved_model": "opencode-go/kimi-k3",
          "resolved_model_marker": "build · kimi-k3",
          "executor_command_shape": "opencode run -m opencode-go/kimi-k3 --variant max <PROMPT>",
          "transport": "cli",
          "fallback_used": false,
          "exit_code": 0,
          "timed_out": false,
          "latency_seconds": 11.547,
          "output_contract_valid": true,
          "expected_findings_found": 2,
          "expected_findings_total": 2,
          "refused": false,
          "changed_file_count": 0,
          "failure_class": null,
          "failure_cause": null,
          "usage": {"exposed": false, "input_tokens": null, "output_tokens": null, "cached_tokens": null, "cost_usd": null}
        },
        {
          "task": "security_review",
          "requested_model": "opencode-go/kimi-k3",
          "resolved_model": "opencode-go/kimi-k3",
          "resolved_model_marker": "build · kimi-k3",
          "executor_command_shape": "opencode run -m opencode-go/kimi-k3 --variant max <PROMPT>",
          "transport": "cli",
          "fallback_used": false,
          "exit_code": 0,
          "timed_out": false,
          "latency_seconds": 21.434,
          "output_contract_valid": true,
          "expected_findings_found": 2,
          "expected_findings_total": 2,
          "refused": false,
          "changed_file_count": 0,
          "failure_class": null,
          "failure_cause": null,
          "usage": {"exposed": false, "input_tokens": null, "output_tokens": null, "cached_tokens": null, "cost_usd": null}
        }
      ]
    },
    {
      "model_id": "opencode-go/glm-5.2",
      "variant": "high",
      "evidence_tier": "new-three-task-matrix",
      "catalog_cost_usd_per_million": {
        "input": 1.4,
        "output": 4.4,
        "cache_read": 0.26
      },
      "summary": {
        "cells": 3,
        "expected_findings_found": 5,
        "expected_findings_total": 5,
        "output_contract_passes": 3,
        "refusals": 0,
        "mean_latency_seconds": 13.586
      },
      "cells": [
        {
          "task": "routine",
          "requested_model": "opencode-go/glm-5.2",
          "resolved_model": "opencode-go/glm-5.2",
          "resolved_model_marker": "build · glm-5.2",
          "executor_command_shape": "opencode run -m opencode-go/glm-5.2 --variant high <PROMPT>",
          "transport": "cli",
          "fallback_used": false,
          "exit_code": 0,
          "timed_out": false,
          "latency_seconds": 10.585,
          "output_contract_valid": true,
          "expected_findings_found": 1,
          "expected_findings_total": 1,
          "refused": false,
          "changed_file_count": 0,
          "failure_class": null,
          "failure_cause": null,
          "usage": {"exposed": false, "input_tokens": null, "output_tokens": null, "cached_tokens": null, "cost_usd": null}
        },
        {
          "task": "contract_drift",
          "requested_model": "opencode-go/glm-5.2",
          "resolved_model": "opencode-go/glm-5.2",
          "resolved_model_marker": "build · glm-5.2",
          "executor_command_shape": "opencode run -m opencode-go/glm-5.2 --variant high <PROMPT>",
          "transport": "cli",
          "fallback_used": false,
          "exit_code": 0,
          "timed_out": false,
          "latency_seconds": 4.192,
          "output_contract_valid": true,
          "expected_findings_found": 2,
          "expected_findings_total": 2,
          "refused": false,
          "changed_file_count": 0,
          "failure_class": null,
          "failure_cause": null,
          "usage": {"exposed": false, "input_tokens": null, "output_tokens": null, "cached_tokens": null, "cost_usd": null}
        },
        {
          "task": "security_review",
          "requested_model": "opencode-go/glm-5.2",
          "resolved_model": "opencode-go/glm-5.2",
          "resolved_model_marker": "build · glm-5.2",
          "executor_command_shape": "opencode run -m opencode-go/glm-5.2 --variant high <PROMPT>",
          "transport": "cli",
          "fallback_used": false,
          "exit_code": 0,
          "timed_out": false,
          "latency_seconds": 25.981,
          "output_contract_valid": true,
          "expected_findings_found": 2,
          "expected_findings_total": 2,
          "refused": false,
          "changed_file_count": 0,
          "failure_class": null,
          "failure_cause": null,
          "usage": {"exposed": false, "input_tokens": null, "output_tokens": null, "cached_tokens": null, "cost_usd": null}
        }
      ]
    },
    {
      "model_id": "opencode-go/deepseek-v4-pro",
      "variant": "high",
      "evidence_tier": "new-three-task-matrix",
      "catalog_cost_usd_per_million": {
        "input": 0.435,
        "output": 0.87,
        "cache_read": 0.003625
      },
      "summary": {
        "cells": 3,
        "expected_findings_found": 5,
        "expected_findings_total": 5,
        "output_contract_passes": 0,
        "refusals": 0,
        "mean_latency_seconds": 9.7
      },
      "cells": [
        {
          "task": "routine",
          "requested_model": "opencode-go/deepseek-v4-pro",
          "resolved_model": "opencode-go/deepseek-v4-pro",
          "resolved_model_marker": "build · deepseek-v4-pro",
          "executor_command_shape": "opencode run -m opencode-go/deepseek-v4-pro --variant high <PROMPT>",
          "transport": "cli",
          "fallback_used": false,
          "exit_code": 0,
          "timed_out": false,
          "latency_seconds": 8.044,
          "output_contract_valid": false,
          "expected_findings_found": 1,
          "expected_findings_total": 1,
          "refused": false,
          "changed_file_count": 0,